[
  {
    "video_id": "11111111-1111-1111-1111-111111111111",
    "url": "https://example.com/clips/3-ai-apps.mp4",
    "characteristics": {
      "audio": "music+VO",
      "transcript_summary": "3 AI apps that changed my life — fast talking-head listing tools with bold claims.",
      "cut_count": 7,
      "on_screen_text": "you NEED this",
      "subtitles": true
    },
    "metadata": {
      "duration_ms": 18000,
      "created_at": "2026-06-01",
      "creator": "@techbro",
      "likes": 124000,
      "shares": 8200
    }
  },
  {
    "video_id": "22222222-2222-2222-2222-222222222222",
    "url": "https://example.com/clips/honest-review.mp4",
    "characteristics": {
      "audio": "VO",
      "transcript_summary": "My honest review — slow intro, calm tone, no strong hook in the first seconds.",
      "cut_count": 2,
      "on_screen_text": "honest review",
      "subtitles": false
    },
    "metadata": {
      "duration_ms": 22000,
      "created_at": "2026-05-20",
      "creator": "@sara",
      "likes": 9800,
      "shares": 210
    }
  },
  {
    "video_id": "33333333-3333-3333-3333-333333333333",
    "url": "https://example.com/clips/i-tried.mp4",
    "characteristics": {
      "audio": "music+VO",
      "transcript_summary": "I tried the viral dev tool for a week — punchy hook, quick cuts, captions throughout.",
      "cut_count": 9,
      "on_screen_text": "I tried it for 7 days",
      "subtitles": true
    },
    "metadata": {
      "duration_ms": 16000,
      "created_at": "2026-06-10",
      "creator": "@devtok",
      "likes": 64000,
      "shares": 3100
    }
  }
]
